{
  "archiveVersion": 1,
  "protocolVersion": 1,
  "exportedAt": 0,
  "activeNoteId": null,
  "nodes": [],
  "documents": [],
  "settings": {
    "settingsVersion": 1,
    "theme": "midnight",
    "compactSidebar": false,
    "showPageIcons": true,
    "reduceMotion": false,
    "rememberLastNote": true,
    "editorFont": "inter",
    "editorLineHeight": "comfortable",
    "showLineNumbers": true,
    "editorPlaceholder": "Start writing..."
  }
}
